sentiment,text
5,except trains capital intensive limited mobility driverless cars best worlds
5,want google driverless car
5,driverless ooooh would awesome
5,much awesome amazing video googles next phase driverless cars via
5,making driverless cars awesome
5,could call driverless car tell car take whoo hoo
5,googles driverless cars I shall I take one
5,driverless taxis nyc would probably amazing application
5,whole driverless car prototype thing awesome
5,googles new driverless car no brake pedal steering wheel via fantastic
5,riding driverless car bucket list damn exciting google
5,future oh places go cannot wait driverless car scichat
5,driverless car great idea someone like eye condition makes unable drive car
5,need driverless cars
5,google developed driverless car fucking chill
5,cannot wait driverless cars soon rarely drive many lives saved
5,coming driverless cars I
5,want driverless car bad
5,driverless cars could also end drunk driving forever save lives
5,skynet driverless cars sick accidents injuries deaths people driving recklessly time must stop
5,driverless cars eliminate traffic crowded cities says mit
5,less road rage rt potential benefits driverless cars stunning
5,mercedes benz driverless research car looks amazing satamadik halaa
5,session watching listening head googles driverless car program absolutely fascinating
5,driverless cars sound awesome actual economic impact going blow mind
5,cannot wait driverless cars come first time I excited motor vehicles entire life
5,love times age horse less driver less travel mt google build driver less cars
5,hour drive ahead driverless cars cannot get fast enough
5,driverless carsjust think potential productivity amp safety gains via
5,poll drivers love idea driverless cars driverless selfdrivingcars autonomouscar cars
5,google survey asked I I would use driverless car wished hell yes radio selection cantwait takemymoney
5,excited google glass driverless car demo couple minutes yglsvs
5,driverless car appeals instead real estate chauffeur one become
5,imagine world virtually no duis massive traffic jams increased productivity wealth driverless cars big us
5,awesome last night seeing googles driverless car stanford tonight heaven
5,burkhard bilger inside googles driverless car man want self driving car badly
5,yes yo daughter says cannot wait driverless car
5,driverless cars love google takes big challenges shares insights students
5,total believe googles driverless car safer average driver
5,one excited self driving cars googles driverless car safer average driver
5,fun exciting mental exercise play thinking future driverless cars killerapp
5,would like go drive guys driverless cars safest cars ever
5,driverless shared cars much less expensive much safer obey rules cannot wait years
5,driverless car need get one
5,volvos new suv super safe semi autonomous driverless controls autopia wired
5,first ever tweet cruising driverless car mindboggling sensorial experience thx google whoahorsey
5,amazon prime air almost incredible googles driverless car
5,jealous gets ride driverless car still ready beta one
5,age driverless cars cannot come soon enough
5,wow driverless vehicles even streets dc
5,self driving cars sounds good headline california okays driverless cars
5,push google california legalizes driverless cars baby seen cars like hereampthere
5,future googledriverless carsspace elevators mindblown
5,automotive technology driver less cars reduce accidents ease congestion
5,cool rt score california becomes second state nevada legalize driverless cars
5,getting one hurry ky push google california legalizes driverless cars
5,say word driver less car california sweet
5,google stocks already skyrocketing driverless approved ca
5,go google driverless cars hope
4,cant wait googles driverless cars take less efficient route destination pass billboards deemed relevant
4,googles driverless car desperately needed florida codecon
4,finally google started making cars fully integrated driver less car prototype no strafing wheel recode
4,sodid apple buy wasnt sure news company building driver less cars way cooler
4,sorry forgot driverless cars cool though smwf
4,love newest driverless car no steering wheel gas pedal buttons start panic
4,I writing word essay niggas google driverless cars making ground breaking shit damn è
4,driverless cars make buses amp taxis unnecessary solve parking issues kids sports amp activities
4,actually believe less people nervous seeing google driverless car come street one behind wheel
4,driverless car invented google completed miles two accidents humans cars hit prius
4,driverless revolution rolls sent cnnmoney app android
4,need driverless cars
4,august google driverless cars driven total miles reported accidents fault human driver
4,eliminate caraccidents driverless cars roads healthcare
4,meet stanley driverless car successfully navigated km road race
4,enjoyed panel saturday thanks coming ottawa regarding driverless cars theres hope
4,dreams owning mr bean type google driverless car dreams matts bean imitation
4,would love driverless cars cut biggest costmake rides much cheaper codecon
4,ubers future car fleet driverless cheaper uber technologies inc envisions future
4,checking google driverless car guess would call smart car science
4,finally google started making cars fully integrated driver less car prototype no searing wheel recode win
4,ceo board qualcomm sees potential driverless cars eyesight driverless cars one market
4,time dmv says no longer drivei still get around w driverless car
4,sure look expensive next driverless vehicles
4,driverless cars no steeringbreaks cannot wait taxis live mph tops nyc
4,driverless cars go regional rail stations literal best possible solution
4,google unveils driverless car complete no steering wheel crazy watch videos mind blown
4,interest something blue mt googles driverless car good news bad drivers
4,google self driverless car buttons no steering wheel no brake pedals im definitely loving tech innovation
4,based stupid people drive let us hope cars driverless soon
4,googles driverless car dope
4,yes still cars combine driverless cars tech amp little parking needed topoli
4,bullseye rt loses driverless cars insurance companies no one dies crashes
4,trip googles driverless car via googlecar futureride bring soon
4,solar roadway pave way driverless cars cannot wait thefutureisnow
4,driverless cars public transportation done right yes
4,cool good video driverless cars coming whether want not
4,far googles driverless cars traveled miles autonomously accident reported goog
4,driverless future far closer anyone dreamed via let us hope
4,august googles driverless cars driven miles two accidents reported time
4,driverless car nice
4,I obsessed driverless cars economists september article still worth reading
4,cannot wait day drunkenly stumble google driverless car tell drive texas wake
4,autos expected driverless tech fantastic cuz I shall I fighting give car
4,free uber cause nyc safer bikers full driverless cabs
4,warning nerd tweet I really excited google io keynote shall probably talking driverless cars wearables glass
4,google driverless cars freedom disabledautism one example news roseville ca sacramento metro
4,driverless cars side swipe idiots bicycles stupid pedestrians
4,smarter move invest driverless cars
4,install box car youll driverless car really wanna test thing
4,goog driverless cars teslas ev technology could combine ultimate car future
4,think tracy morgan crash may nudge acceptance toward driverless cars foresee highways robot fleet vehicles coming years
4,thinks driverless cars lead new printing innovation
4,things let us get driverless cars road first safety must account bad drivers today
4,saw kid get pulled prius stretcher got hit semi becoming fan driverless cars
4,love google got tired retrofits existing cars said fuck build driverless cars
4,challenge driverless cars safer higher proportion crashes result manufacturer error
4,saw man driven around passenger seat google driverless car mindblown
4,google driverless car changes everything business google googledriverlesscar dmv
4,easier sorry last tweet go interrupted ran old lady driverless car would come handy
4,taking ride driverless car furtherwithford test track
4,box roof turns car driverless pretty cool get market
4,congrats press week could toy pave way driverless cars
4,appreciate talk driverless cars morning utsdnews
4,driverlessuber
4,clean safe amp drives weeks economists special report future car driverless yes please
4,driverless car invented google completed k miles accidents humans cars hit
4,actually actually optimistic driverless cars really help car sharing come zipcar
4,driverless cars still distant dream work faster google
4,driverless cars could use one hour drive
4,much revenue google make last year billion glass driverless cars mature trillions
4,driverless car no problem automatic sink paper towel rest room nothing works without vogueing
4,nope driverless cars quantum computing wifi blimps google planning world domination I okay
4,robot driverless car scifi future google w pic
4,googles driverless cars already testing better humans
4,like numbers much driverless cars really save us
4,driverless cars tested california I shall I soon fulfill childhood dream owning kitt
4,soon buy driverless car I going get one backroad across country
4,race driverless cars full throttle google innovators say may five years away
4,driverless car invented google completed miles two accidents humans cars hit
4,cannot wait driverless vehicles norm obviously away cause still spell checked word
4,saw google driverless car today lexus rx hybridnice I hoping pilotless planes next agenda google tech
4,good q half deaths medical errors traffic deaths year us driverless car reduce number
4,google glasses banned drivers use google driverless car
4,starting save money elon musk talks google bring driverless tech tesla cars
4,saw driverless car highway played ball former miami dolphin todaywasagoodday fb
4,well good news parking space problem gone driverless cars
4,street cars trollies bikes amp driverless cars urban solution cc googcommercedev
4,driverless cars want one
4,wave future driverless cars anti wreck technology needs insurance
4,sometimes see google drive app phone get really excited think summon driverless car take around
4,I glad driverless vehicles legalizes one state already probably not
4,fbi warns driverless cars could used lethal weapons regular cars cannot right
4,hey fbi driverless cars not kill people people kill people
4,swing pick us driverless car hits tampa bay road test
4,baby driverless
4,driverless electric cars uk wow
4,need aftermarket driverless car mod mobile wifi
4,tesla google uber tesla makes sexy google makes driverless uber makes available future people
4,want driverless car
4,driverless also keep operating costs right
4,google investing driverless cars internet balloons wearables microsoft invests search engine come
4,driverless cars nyc no parking insanity mt would not nice cont
4,think best argument driverless cars could eat tacos commuting
4,sign one first driverless cars
4,sit back nap play board games watch netflix driverless car takes us across country buy
4,not wait driverless cars norm highways
4,audi testing driverless cars expressway tampa tomorrow pretty dope
4,since speed limit driverless cars cannot programmed exceed going fun
4,need move britain driverless cars hit public roads britain january
4,driverless cars going take us new age like transitioned horses cars
4,woman airport bar things clearly drunk buffalo telling everyone benefits driverless cars
4,keep pushing hard driverless cars shall save millions lives billions hours productivityquality time
4,boost driverless car see huge benefits esp mobility people cannot drive old young poor downside nsa
4,driverless cars humans terrible drivers computers less terrible
4,driverless cars could hit local roads imagine able work laptop video conference
4,experimenting driverless cars nothing bad could come
4,wish driverless audi tt could follow around praise google
4,wow saw google driverless car cool
4,googles driverless car safer average driver check john
4,saw google driver less car zoom google campus
4,google driverless cars wtf mindblown
4,well little terrifying still want driverless car lifetime though
4,I fascinated idea driverless cars sen risser thinks wi could cold weather testing ground
4,look driverless cars make intersections efficient scary
4,driverless cars make intersections efficient scary
4,look floor wait driverless car presentation sounds interesting
4,looking forward future driverless car millenials readily adopt
4,please hurry driverless car thing people texting kill us spotted freeway morning
4,carlo ratti keynote driverless city require less automobile infrastructure mobility yes please urbanbigdata
4,car accidents amp near miss metcalfe mclaren time test drive driverless cars ottawa ottvote somerset ottpoli
4,thinking programming google driverless car hunt road kill sleep road kill jerky
4,wish would hurry get driverless cars road pushing gas pedal paying attention getting old
4,fleet driverless cars way smarter people find efficiencies routes rarely need park zones
4,would good teddy amp mary jo k driverless car takes test run dc
4,google driverless car uber best money bot ever
4,want one driverless vehicle like pilot using autopilot coming omg excited automotive
4,oh wrong driverless cars cannot come soon enough
4,uberpool going big deal get working driverless fleet thats enough make walt disney cry
4,dudes like driverless cars
4,atlanta cant fix mass transit urban sprawl issues car centric city focus driverless cars instead
4,engineering ha would easy autonomous driverless completely self controlled win
4,cannot wait blunt cruise google driverless car holy shit
4,sadly probably safer cars rt driverless vehicle hits streets dc
4,driverless cars better drivers humans agree r programmed obey law
4,want driverless car bad seriously would happy tomorrow morning no drivers behind wheel
4,one googles engineers developing driverless caramazing
4,could play immersive driving games simulations driverless car probably much exciting
4,want see googles driverless car rolls austin via
4,sees driverless cars available consumers years boom happy hours
4,rt wsjs auto critic dan neil driverless cars inevitable good thing
4,wsjs auto critic dan neil driverless cars inevitable good thing roadsoady notickets
4,I fascinated driverless caravans future
4,cannot believe less years shall able driverless car googlecar
4,score california becomes second state nevada legalize driverless cars
4,really interesting article future driverless cars transit system
4,google driverless cars drive kids soccer practice would totally help
4,google would feel safe driverless car calif gov jerry brown
4,driverless cars stay many lives shall save
4,driverless cars legal california road head became less dangerous ladies come check robot car
4,want driverless car powered apple maps
4,cannot wait driverless cars actually makes true
4,blow mind wanting say driverless cars remake transit system
4,driverless cars legal thats probably intelligent thing ever
4,safe nearly driverless transportation centuries railway
4,california legalizes driverless cars wtf right leave california
4,trust driverless cars long use google maps
4,wsjs auto critic dan neil driverless cars inevitable good thing text
4,score california becomes second state nevada legalize driverless cars drink amp not drive
4,happy birthday google young drive no problem make driverless cars
4,nerds galore ca becomes state nv legalize driverless cars robot automotive kitt knightrider ai
4,cannot wait get driverless cars imaginei like otter said animal house road trip
4,go driverless save operating costs increase frequency
4,driverless cars see great future imagine could commute binge watch latest netflix series
4,get hands driverless las vegas going experience cartech audi
4,really want said driverless car eight hour drive nc
4,bmw hits performance limits driverless car via
4,crazy possible see day drunkasses driven around driverless taxis
4,cool rt streets ann arbor soon filled driverless cars
3,time came knew would look like egg google unveils driverless car
3,nope google invested uber driverless cars
3,googles driverless cars no brakes steering wheel coming streets year google
3,driverless cars supposed taxis though not personal vehicles
3,funny think texting driving no hands future thx driverless cars
3,googles driverless car future might really look like
3,googles new driverless car no brake pedal steering wheel not cool
3,rangers driverless cars david frum twitter right dont like one bit
3,says experience googles new driverless car wanted drink wanted text drink codecon
3,googles next phase driverless cars no brakes steering wheel via
3,car worthy jacques tati via google reveals driverless car prototype
3,di caro uses last question ask driverless cars mocotranspo wild card question
3,mt driverless cars n self driving seat googleme bigdocc
3,google driverless cars somewhere hasslehoff putting shades
3,google got states legalize driverless cars via need
3,tmlt though also said today eventually replace drivers driverless cars
3,google innovating driverless car
3,google rolling driverless car
3,google unveils prototype new driverless car no steering wheel diver pedals
3,qualcomm wants make eyes driverless cars
3,get look driverless car
3,way people glued phones may already driverless cars
3,likes brag jobs creating promising shall use driver less cars asap
3,googles driverless car future might really look like
3,driverless cars explicitly implicitly different set needs wants becomes tool less fashion choice
3,google build prototype truly driverless car google plans build launch onto city streets small
3,no saw one thoughts driverless cars mobile isolation cells dystopia
3,warren buffett said googles driverless car catches insurance providers like geico would negatively affected point
3,q googles driverless cars programmed kantians utilitarians need design lots ethical edge cases cc
3,u center breaks ground facility test driverless vehicles officials public private partnership
3,future driverless cars
3,psa trains driverless cars much way airplanes space shuttles rt get blocked reported spam
3,jake interesting conversation driverless cars day
3,test driving googles driverless car look mom no hands
3,learning politics processes passing laws legalizing googles driverless cars way worth tuition
3,driverless road ahead
3,driverless car invented google completed miles two accidents humans cars hit
3,ann arbor driverless car test site gets industry partners david runkassociated press detroit ap general
3,california start issuing driverless car licenses september iot connectedcar ibminnovate
3,finally california start granting licenses driverless cars september
3,california start granting licenses driverless cars september
3,driverless cars break law little doubt technology behind driverless cars nearly
3,driverless car storyline mike judge element silicon valley yet office space idiocracy
3,wonder driverless car going sound archaic horseless carriage years
3,driverless cars get california licenses starting september go
3,driverless thing could run cute baby seals wouldnt part initial news googs ca not mi expected
3,googles new driverless car future driving
3,like woody allens sleeper come true first drive google driverless car
3,driverless car still drive better massachusetts drivers eh
3,google unveils driverless car bbcgofigure
3,google build prototype truly driverless car google plans build launch onto city streets small
3,watch googles driverless car action via
3,googles new driverless car no brake pedal steering wheel
3,met driverless car intersection
3,driverless cars means no one flip
3,googles driverless car mean kids take school no pushy parents bmws escalades
3,caught show I picturing driverless cab cos nyc guys would printing money
3,googles new driverless cars robo taxis no brake pedal steering wheel taxi google
3,apparently driverless cars require dress code future
3,people using cars driverless not time not still lot idle car time
3,borrow driverless car take bread co
3,uber ceo expect driverless cars record funding round future uber technologies inc envisions future
3,laundry cart accident apartment minute ago driverless cars cannot come fast enough
3,started nevada google got states legalize driverless cars
3,qualcomm ceo steve mollenkopf shares thoughts driverless cars amp codecon
3,google got states legalize driverless cars four years ago google team trying develop cars
3,driver less cars googs guess bc hate driving stance
3,guess no driverless car team office evil stuff like ads
3,california start granting licenses driverless cars september
3,california giving google licenses driverless cars
3,google got states legalize driverless cars
3,google driverless car skype translate discussion necn via
3,process buying car keep thinking might last gas car ever buy last one not driverless
3,driverless cars get green light california
3,no comment response solar roadways correlation google driverless cars I taking yes
3,california sets regulations testing driverless cars
3,california start granting licenses driverless cars september
3,could possibly go wrong googles next driverless cars no brakes steering wheel code con
3,google driverless car looks similar steveurkels car lol
3,late detroit driverless cars
3,driverless cars compatibility mode trains unwalkable suburbs retrofit
3,day google shows driverless car apple decides algorithms not not stirring people enough spends hand curated music
3,continue follow amp vision driverless cars check new group set I I would try one
3,google building truly driverless car no brakes steering wheel gas pedals
3,driverless rides headed detroit
3,google reveals driverless car prototype skynet cc
3,googles plans driverless car morning
3,sergey brin unveils new google driverless car prototype
3,design inspiration googles new driverless car
3,google unveils driverless car could possibly go wrong
3,visionzero actonclimate net zero best nyt googles next phase driverless cars no brakes steering wheel
3,crazy google unveils driverless car bbcgofigure
3,not see driverless family cars anytime soon instead see johnny cabs totalrecall googleselfdrivingcar
3,read google unveils new driverless car prototype
3,get bezos amazon drones cap america shipping driverless car
3,leaked spy shots new driverless cabs testing
3,drivers making yr driverless car multi decade transition let us take breath I shall I see year
3,google build prototype truly driverless car google plans build launch onto city streets small
3,yep things googles tiny new driverless car looks like totoro
3,googles driverless car action go
3,driverless car googleselfdrivingcar
3,googles new driverless car no brake pedal steering wheel fuck
3,google build prototype truly driverless car
3,know designed driverless car future check
3,us ready make billion bet driverless cars technology
3,california start granting licenses driverless cars september via
3,cops give car ticket driverless cars started hitting roads california
3,normal day kevin wait see driverless google car welcome silicon valley
3,saw one weekend phoenix driverless cars question challenge google not haters
3,hi guys driverless cars yet motors world headquarters
3,google driverless car akin riderless bike would bike want go without answertounaskedquestion
3,saw driverless car today chicago ave
3,california going start offering licenses driverless cars year jetsons didnt see one coming
3,driverless cars unmanned aerial vehicles smart machines implications endless
3,u center breaks ground facility test driverless vehicles ann arbor officials public private
3,ford gm toyota join u ms èdriverless vehicle test ann arbor mich ap university michigan says
3,mt real driverless car company determined drive change
3,goodbye peter gregory hope driverless cars heaven
3,like idea adding bitcoin internet traffic give first class priority driverless cars paying one another pass
3,driverless cars coming
3,nope americans would ride driverless car possible would
3,mountain view got passed driverless car future
3,family back fl three cars driverless cars amp tampa regional rail would let
3,driverless cars technology trumps experience edtech edchat txed
3,driverless cars not legal googles answer unorthodox lobbying campaign mountain view
3,moral machines driverless car dilemma
3,googles driver less car morality
3,not driverless promising considering classified bike legal roads
3,another nitpick define driverless cars kid playing drivers seat knocks normal car park
3,driverless car google
3,rt breaking news ca cancels driverless cars state hwys cars driving tx tn search better life
3,second one driverless cars impact drivers car accident industries whole ecosystem
3,interesting take driverless cars mean future driving via fb
3,fake google driverless car crashes manhattan gt fatlab
3,trying gauge unintended consequences driverless cars future driving via
3,dmv seeking input rules driverless cars dozens attended workshop friday dmv officials
3,dmv seeking input rules driverless cars
3,driverless cars solve energy problems create new ones
3,two things think future automotive technology heads displays driver assist bringing us closer driverless
3,yes could driverless cars solve distracted driving
3,tudetroit driverless cars replace taxis delivery vehicles butler going happen
3,driverless cars
3,ibminnovate expanding system complexity internetofthings driverless cars coming
3,true guess work super reliably everyone would driverless cars
3,driverless cars take old people set go really slow
