sentiment,text
3,googles moonshot idea use driverless cars cities public health initiative eventually phase fatal accidents human error
3,rudderless congress breaks driverless car
3,users things dont anticipate driverless car demo halt hitting kill switch video
3,never give government employee keys even car driverless
3,driverless cars constantly track locations recording everywhere google search changed world
3,cruise driverless cars
3,googles newest driverless car no steering wheel gas pedal buttons start panic ha
3,molecular scanners smartphone glow dark trees amp affordable driverless cars future
3,moving wisconsin driverless cars legal state check map
3,suspect uber lyft want way order driverless car take somewhere
3,cannot wait survey insanity drivers flipping driverless cars
3,people driverless cars pay car insurance
3,googles driverless car grey thing top scanning laser rotates times second
3,btr hit week regarding driver less cars seen
3,find google driverless car legal state
3,ca approve driverless car testing insurance vehicle testing bond required suretybond suretybonds
3,part not want like part knows future lap fords driverless transit van
3,james bond ride driverless aston martin incapacitates villains nerf bullets silly string
3,driverless cars red barchettas rush predict google controlled future
3,daily talker flying car driverless car company woburn hopes first flying car production
3,google driverless cars blindabilities via
3,imagine googles driverless car voiced elaine stritch imagine mother
3,gm afraid new google driver less car
3,fun hear thoughts future driverless cars new interfaces cyborgs
3,future upon us wait summon driverless google pod transportation
3,uk rewrite road laws pave way driverless cars yessssss
3,examples technology outpacing regulation news today drones uberlyft airbnb driverless cars
3,university michigan builds fake city driverless car testing via
3,uk science minister races legalize driverless cars cc
3,dreamers google announces driverless cars less years would buy one followusandgrow
3,driverless cars handle torrential rain like every summer afternoon afternoon florida tested yet
3,driverless cars shown universally safer passengers drivers liability capped
3,ford commercial claimed uses driverless technology spurs game yeah use term googlescoming
3,beautiful day driverless vehicle presentation house tampi transportation
3,driverless cars honda said no one ever really worldpeaceinstead
3,interior driverless car featuring big red button not push
3,see intvw challenges driverless car safety
3,startup challenging googles driver less car simple sensor
3,ca sb must amended provide googles driverless cars gather data necessary operate vehicle
3,could possibly go wrong rt helicopter drones driverless cars working tandem
3,introducing driverless cart moonshots
3,secrets google driverless cars
3,would get driverless car takes inside one sure
3,future impact insurance driverless cars fleeing parking lots hail storm ha possibilities workhumor
3,I excited driverless car future ironic uber promotes well pay drivers pushing hard kill jobs
3,heard rumor driverless test car drove office need spend time outside
3,feds cool driverless cars bbgnbt
3,driverless steering less google caryes
3,university michigan builds fake city driverless car testing
3,driverless cars still iron shirts
3,google launching internet balloons driverless cars apple introducing dark mode nail gt coffin
3,reading driverless cars could cripple law enforcement budgets colin neagle
3,google plans launch driverless cars next year dailyfinance
3,solarinfrastructure solarelectric car amp truck mini car alliance google make driverless car solarelect plane
3,trucks drive cars driverless cars googlecar
3,uber goes driverless car group honking pick pick picking new puppy
3,I waiting requests google driverless car tap button
3,hey life googles newest driverless car no steering wheel gas pedal buttons start panic
3,car needs googles newest driverless car no steering wheel gas pedal buttons start panic
3,ceo steve mollenkopf shares thoughts driverless cars amp codecon heres mines terminator
3,world driverless cars driven map
3,chuck holland vp industrial engineering ê see driverless vehicles delivering packages see drones delivering fordtrends
3,driverless car day parked cab protesttraffic near capitol members wishing could ride cc
3,cnbc says ca insurance companies requiring ride sharing cars carry expensive insurance driverless cars coming
3,driverless cars startup challenging googleêwith simple sensor tech
3,meet sensor could make cars driverless
3,danah boyd writes new tech panics used status quo cause next panic driverless cars rheadd
3,testament vision ruthless execution amp growth hacking provide global consistencysome day driverless
3,cruise automation releasing cheaper sensor roof dispositive compite driverless car google
3,driverless cars improved experience near future much solve make amazing gaspar designconvo
3,heard driverless cars carsthatfeel check letsgoplaces
3,driverless fedex trucks loaded drone packages launch close destination
3,driverless car future driverlesscar driverless
3,cool google dreams driverless cars idf deploys via
3,google dreams driverless cars israel defense forces deploy israel
3,uber plans use driverless cars available
3,two posters celebrate launch googles driverless car
3,interesting white paper driverless cars could affect auto insurers thanks anne great insight
3,googles driver less car no steering wheel no brake petal amp no gas petal
3,buy new google driver less car expense pearsonspecter
3,ai future heart driverless cars autonomous devices
3,think I driving hand è driverless innovation
3,think driverless car friendly horse without chooses let control
3,warning signs future driverless taxi
3,mercedes benz following lead driverless car next
3,looks like goog really serious making driverless car nothing sneeze
3,police car several driven driverless truck motor something running night
3,google jumps top ten patent recipients powered wearables robots driverless cars google pushed
3,uber go driverless
3,tampa fl driverless interstate currently constructed tie atl not apply gov pass voters
3,company claiming upfit car driverless starting next year
3,inhabitat michigan building fake acre city test driverless cars
3,driverless tech first comes carriage law gary anglebrandt although states michigan
3,think driver less cars future transportation
3,no problem officer less ticketing breaks driver less car
3,driverless cab nyc bridge
3,cruise automation driverless cars startup challenging googleêwith simple sensor via
3,ride sharing eating taxi industry lunch drivers jumping ship course wont long etc operate driverless fleets
3,startup challenging googles driverless car simple sensor kinect
3,startup challenging googles driverless car simple sensor
3,mercedes driverless car
3,driverless cars ilovenuitblanche snbto toronto lovenuitblanch lovetoronto art kia
3,crash cars driverless cars loop constant speed threatening collide snbto toronto
3,driverless cars driving imagine insane è
3,cars driving è no actual drivers cars driving nodrivers driverless
3,driverless car nathan phillips square snbto
3,much tip skynet rt six questions ask driverless cars via
3,blind man drives google driverless car automotive aid
3,rt driver less cars coming see cyclists coming carlton reid safety
3,driverless car forming nathan phillips square toronto nuitblanche scotiabank snbto
3,wireless skins accident proof trains driverless cars hitachi cto hu yoshida bigdata via
3,take ride driverless car public street theb see no reason building cannot wiggle little glynn archwhims
3,desoto cab announces first driverless taxi
3,driver less car still cannot edit tweet
3,dmv hosts norcal workshop create rules driverless cars san jose cbsap auto officials saying
3,imagine zip car drove information technology innovation foundation president reality driverless cars
3,time finally come driverless car
3,driverless cars bill ridingroughlywest
3,driverless car bill aims smooth technology fast lane dustin walsh michigan legislature not taking
3,im not sure think would defeat perception driverless cars elec cars r pretty much cars
3,may obsoleted actually everything driverless point ever going slower max speed
3,picking driverless cars
3,ha see driverless cars run sidewalks belt line thoughts supernovasouth
3,insurance forum future insurance client communication driverless cars ontario museum
3,wonder programming languages mercedesgooglesetc using write software driverless cars
3,wondering driverless cars trigger totally new designs cars future
3,driverless cars provide disruption overshot car market less superfluous stuff sell less involved ego cheaper cars
3,driverless cars bicycle sculptures nuitblance toronto phillips square
3,good read ignores trucking industry driverless cars away think
3,answer tampa summit feature driverless cars transit option
3,talking night makes sense driverless car tesla
3,flightless drones ahh dmv seeking input rules driverless cars
3,dmv seeking input rules driverless cars dozens attended workshop friday dmv officials
3,dmv ponders regulate driverless cars california must set guidelines
3,going park driverless car able park driverless car free
3,going drive driverless car manhattan going always park free manhattan
3,many driverless taxi accommodate typical american traffic patterns wo spaces parking
3,driverless cars affect cities
3,snyder wants michigan approve driverless cars michigan gov rick snyder said googles driverless car
3,I thinking something like preview inevitable asimo falls video driverless car
3,espärito santo state university uses ubuntu developing driverless car brazil linux
3,prevent us watching vids driverless cars cars safer wout us drunktexting
3,least agree driverless uber
3,googles driverless car driven miles ca already yptbwp
3,manhattan cleveland build spaces temporary store driverless car
3,park driverless car reached destination
3,levanowski google driverless car god trust others bring us data energyideas
3,disrupt comfort gtgt larry page defends googles big bets glass driver less cars
3,driverless cars affect cities
3,tech talk tonight jeff johnson driverless cars amp rosey robot info east hosted
3,mean tell driverless cars vacums still sound like kingkong
3,googlex folks talking driverless cars kvsummit perseverance
3,said talk shall run us driverless cars
3,wait driverless cars
3,tesla talks partnering google driverless cars tesla motors considering adding driverless technology
3,tesla talking google driverless electric cars via
3,pardon future go right ahead via driverless driverlesscar google
3,driverless cars amazing govts not looking seriously risk big move white elephant onpoli
3,saw google driverless car
3,driverless cars eventually replace taxi drivers
3,rt rt ready driverless cars pbs newshour
3,guy driving ipad google driverless car punks nyc
3,ready driverless cars pbs newshour
3,looking completely driverless camry sorry toyota believes control remain
3,high speed road driverless future
3,high speed road driverless future via interesting cameras lenses get dirty
3,goal google kids start driving susan wojcicki driverless cars
3,drove work today car drive tune find u ur driverless car
3,sf maäana get educated commercialization driverless car fav
3,ktla consumer confidential stock market rally internet sales tax driverless technology not reporting
3,tesla considers driverless cars partnership google amazing
3,tesla talks partnering google driverless cars tesla motors considering adding driverless technology
3,happens car insurance driverless car world time auto insurance companies innovate
3,driverless cars ghost community actively rejoin society operating motor vehicles without causing suspicion
3,oh car must driverless bumper stickers right along
3,audi testing driverless car tampa florida today license plate
3,elevated lanes florida toll road close tests driverless cars background
3,going driverless cars also shoot riderless bicycles thatll knock cyclist deaths nothing
3,techpanel supposed future cars lt years mostly driverless lots happen
3,driverless cars trialled three uk cities january
3,driverless cars get green light testing public roads uk
3,britain starting driverless car tests next year epoch times yes
3,uk let driverless cars loose roads january going not need roads thefuture
3,uk government announces driverless cars allowed public roads trials not issue smh
3,ever vigilant dc cops pull googles driverless car amazingly no one injured via
3,week bots googles driverless cars sure ready fly robot pilot
3,gonna check driverless car
3,ever vigilant dc cops pull googles driverless car amazingly no one injured
3,google driverless car pic
3,looked like googles driver less car
3,acuhoi driverless cars thought controlled robotic motion holographic sensors virtual reality activism
3,really thoughtful take potential impact driverless cars via
3,oh google driverless car
3,really consider subway driverless car
3,really fbi afraid criminals use googles driverless cars freeway shootouts
3,true l driverless yet
3,driverless car tested merced beginning rockets drones
3,encountered one driverless car
3,no fun eh driverless cars becoming reality could british roads next yr
3,shows driverless car tech florida along ride
3,uk plans allow driverless cars public roads starting january could possibly go wrong
3,driverless cars hit public roads britain january
3,nissan announced model driverless car roads thefuture
3,uk town replacing buses driverless pods fl pay disney busses death
3,funny rt saudi women allowed not drive driver less car saudi drivingban
3,rt driverless cars could arrive ann arbor automotive michigan
3,ann arbor test bed driverless cars university michigan researchers work make ann arbor
3,florida aims lead driverless car revolution via
3,driverless trans team field trip day going morgantown ride podcars currently road
3,googles retrofitted driverless car captured
3,ann arbor could get driverless vehicles u working auto industry government officials
3,driverless cars coming uk london cnnmoney first time driverless cars soon
3,ann arbor could get driverless vehicles ann arbor wwjap university michigan working
3,õ driverless cars soon making way streets uk
3,cover driverless cars also donothingcongress teabagtreason
3,burkhard bilger inside googles driverless car
3,humans make bad drivers read discuss burkhard bilger inside googles driverless car via
3,no uber driverless cars natural progression uber drivers disrupted
3,currently society moves towards urban centers driverless cars think affect handheld sales
3,fbi warns driverless cars could weaponized
3,florida wants hq driverless cars might say already
3,fbi thinks driverless cars could deadly fuck
3,time driverless vehicles driverless
3,could driverless cars change everything techtuesday
3,senator calls driverless cars cure disease vehicle related deaths sayfie flapol
3,uk allow driverless cars roads
3,uk allow driverless cars public roads january
3,driverless cars allowed uk soon january autonews
3,driverless cars hit uks roads january approved trials awesome
3,driverless cars florida sooner think
3,iowa county says yes driverless cars driverlesscars autonomous cars selfdrivingcars
3,close upper deck selmon expy driverless car testing lane selmon
3,always ask driver rating hopefully not worry driverless cars come
3,trying figure spoof contents car driverless cars nobel prize winners car times
3,demand cars greater human availability drive cars safely efficiently hence driverless cars hire
3,like turing test driverless autos founding fathers serious foresight
3,audi made driverless car õ
3,saudi market preparing driverless cars one way prevent women driving nobody needs drive womensrights
3,driverless car delivered drone
3,audi stepping driverless car game
3,driver less car mod audi
3,legislators regulators started establish rules road use driverless cars thefuture
3,mass transit based driverless cars coming helsinkis ambitious plan make car ownership pointless
3,hey googlegirl tell got ride one driverless cars
3,driverless car tipping point coming soon
3,exactly total miles likely way uber ridesharing eventually driverless
3,fbi concerned criminals using driverless cars via
3,imagine driverless googlecars end parking place
3,posit newly revived urban streetcars fail automateddriverless tech emerges regional commuting still strongest case rail
3,britain test driverless cars next year london british officials says driverless cars tested
3,uk put driverless cars public roads january
3,burkhard bilger inside googles driverless car via
3,nissan developing driverless cars sunnyvale sunnyvale cbs sf scientists nissans new research facility
3,burkhard bilger inside googles driverless car via selfdrivingcar technology
3,hot fuzz rt british town introduce fleet driverless cars
3,ann arbor could get driverless vehicles university michigan working auto industry
3,ann arbor could get driverless vehicles university michigan working auto industry
3,current state driverless cars
3,google driverless car magnitudes harder tech challenge vs tech powered diagnoses important hisum
3,hisum khoslas mom saw doctor birth children amp age first time driverless car complex solved problem
3,rt another state approved driverless cars
3,driverless cars fix taxi industry except ask economy
3,sebastian thrun googles driverless car ted short video matters sudoku
3,googles driverless car
3,california may soon driverless cars game
3,makes think could people auto show years ago imagined presentation driverless cars
3,driverless cars jevons paradox
3,driverless cars jevons paradox
3,googles trillion dollar driverless car part google wins
3,much longer equips nyc driverless cabs welcome oppose change
3,ok first accept idea one day driverless cars think going
3,driver less cars modern horseless carriage fb
3,perhaps driverless car could pick sex worker would fitting given audience
3,live tweeting screen future well driverless cars one
3,first jetsons reference driverless car discussion
3,driverless car invented google completed ovr miles amp accidents humans hit
3,google brings driverless car austin google developing touting future self pil
3,google brings driverless car austin theres driverless vehicle town no not talking
3,driverless cars idk feel evaluate pros cons manufactured please
3,driverless cars colorado lawmakers may allow denver ap colorado lawmakers debating change
3,economic impacts driverless cars ignores demand elasticityimpacts sprawl oil use driving cheaper
3,nevada one place driverless cars tested weather conditions make exciting place test
3,actually google project called google x making driverless cars shit like
3,googles driverless car part
3,besides drone via google driverless car
3,driverless car nohands james lick fwy
3,check latest driverless cars cbcmtl
3,driverless cars brings google glass hcd experience windshield ht
3,space shuttle simulator check driverless car simulator check
3,believe driverless world auto insurance cheap still want drive shall cost driverless
3,university michigan building fake city driverless cars technology futurology
3,better driverless car solution
3,crowd outside milling waiting driverless cars find dusty eyes rough night asks delucchidoesgoogle
3,gonna legalize marijuana driverless cars
3,äber partner google driverless vehicles
3,driverless logistics education event networking education baseball
3,ever wondered driverless car sees googlecar nightlife
3,rt google forced add steering wheels driverless car designs
3,google forced add steering wheels driverless car designs
3,google driverless cars I feeling lucky button takes random location
3,interesting thought experiment ethics driverless car
3,driverless car runs someone race blame
3,open data driverless buses london transport heads future great innovation story
3,hop driverless car head back googleplex another day googleallstars another feast eggs
3,one professors worked apple first iphone amp works google google glass amp driverless cars èµ life officially made
3,need understand driverless cars not remove humans equation
3,help non driverless cars kill humans per year
3,umyeah rt driverless car kill save child
3,not think scenarios driverless world driverless car kill save child
3,driverless car mobile lidar mt another use driverlesscars besides transport via
3,thought inspiring driverless cars gt impact tremendous jobs people hate siliconvalley scale hits home svforum
3,also driverless robot cars boon mankind slippery slope economic failure class warfare cbcmtl
3,strong illustration ethical questions ahead us gtgt driverless car kill save child
3,inventing tomorrows jobs driverless drones timebroker future awesome tech
3,driverless cars reduce fatalities may added pressure printing tech supply transplant organs
3,lurch yesterday really say ever driving driverless car pull
3,driverless cars streets dc dc driverlesscars
3,missing last driverless car forced take shuttle car rental years since I improvise mission
3,california would permit driverless car long steering wheel huh
3,google forced add steering wheels driverless car designs talking
3,maybe munis medallion concept enroll driverless cars part annual oversight compliance
3,driverless cars way
3,oh maybe pay amazon bitcoins made printer assembled robot driverless car yeah
3,driverless car rules drafted california california department motor vehicles posted draft rules
3,dmv releases draft rules driverless cars california department motor vehicles posted draft rules
3,driverless cars legal michigan long driver
3,auto news driver less cars tested michigan roads
3,snyder signs law allowing driverless cars tested michigan roads dustin walsh gov rick snyder today
3,driverless cars
3,solution parents drive kids driverless cars
3,weeks new trends want us talk driverless car printing time travel
3,google serious driverless cars
3,volvo put driverless cars road sweden ben schiller via no
3,uk threw driverless car gauntlet
3,uk paves way driverless cars
3,uk paves way driverless cars
3,driverless golf carts
3,amazon drones delivering printed floor mats driverless car authenticated nymi ecg wristband paid bitcoin
3,week review new law allows testing driverless cars duggan picks cabinet members foresee acquired
3,new law allows driverless cars michigan roads lansing wwjap gov rick snyder signed law allowing
3,michigan not going sit watch revenue take dive law allows driverless cars
3,inside googles driverless car
3,googles vision delivering packages driverless cars humanoid robots happen amazon drone bs no lol
3,steeri worlds driverless car app via
3,told stop mt weird driverless car spotted going straight ut highway
3,yes fly rt driverless cars could cruising california roads spring via
3,uk paves way driverless cars
3,rt driverless cars use apple maps fivewordtechhorrors
3,gotta van damme angle volvo put driverless cars road sweden
3,volvo put driverless cars road sweden
3,driverless cars verses drones future delivery
3,google already trying deploy driverless taxi fleets makes sense want automate industries enter bostondynamics
3,google win first driverless formula race
3,seen driverless cars zooming way quick somebody call denzel
3,imagine got pull driver less lapd car n got mms incl citationviolation ft
3,driverless cars ethics relativism ethical perspective no correct answer dilemma
3,always fascinating chat drivers todays big car efficiency ev also driver less wise guy
3,driverless cars ubiquitous wireless internet amp electricity growing amp printing organs lenr next thefutureisnow thesingularityisnear
3,also today think driverless cars good idea cbcmtl
3,far driverless car technology come cbcmtl
3,uk allow driverless cars january
3,hang dusty eyes stops getting another driverless car checked bag private jet shrugs
3,driverless car tested dc streets technology
3,driverless white house driverless car takes test run dc
3,cars driverless police sirens necessary
3,driverless cars driverless aerial vehicles goog experiment attract talent near term
3,nascar amp formula one ultimately allow driver less cars races
3,not kill us makes us stronger lt google driver less cars antifragility
3,yeah man search driverless audi parks
3,nightmare google monetizing driverless cars promoted destinations lingerie stores get ad budgets yeah
3,california governor brown signs bill clearing use driverless cars public roads video via
3,push google california legalizes driverless cars
3,california trend setting gov brown signs bill clearing use driverless cars public roads
3,much like corporations driverless cars people
3,transport people never heard driverless cars humbly request audience
3,cannot worse drivers text rt video driverless cars headed california roads sara welch reports
3,googles driverless cars expected become legal california roads today
3,hacked driverless car drives streets night alone wondering time went end
3,start driverless buses
3,ethier amp driverless trending la
3,suppose said apparently georgia already driverless cars
3,driverless cars legal cali
3,california passes driverless car bill
3,watch googles driverless car permitted california roadways
3,yeah bet cops would confused driverless cars street legal california
3,monumental rt california governor brown signs bill clearing use driverless cars public roads video
3,no one seen irobot robottakeover rt w push google california legalizes driverless cars
3,california okays driverless cars
3,bynes lohan car right rt driverless cars street legal california
3,wait driving car non citizen illegal driverless car legal nobody gt somebody world ht
3,heard driverless car street legal not nevada florida california
3,future premier california allow driverless cars roads years bc embrace future likewise
