sentiment,text
3,driverless car driverless marriage hear based others data input computer creates conversation
3,years away see road legal driverless cars drive california soon
3,maybe spend capital funds make driverless transit viable need full cost recovery
3,I really curious impact driverless cars transportation car ownership future
3,bump great justice rt driverless cars could reshape automobiles transportation system
3,california becomes third state legalize driverless cars rt
3,watching presentation google vp sebastian thrun lead driverless car
3,idea teams field third car must driverless no human input allowed totally autonomous
3,already driverless mine trucks pilbarra
3,driverless cars bill signed gov jerry brown nearly years day jetsons debuted abc f
3,driverless cars legal california maybe one day gus gus arrive take wineries no one wheel
3,driverless cars bill signed èè
3,driverless car bill signed california google headquarters
3,scary rt driverless car transforms american food culture
3,well not without driverless cars completely automated factories stores etc someone needs around produce
3,driverless cars available lt years causing drop traffic
3,reported driverless cars legal portions california wtf driverless flying cars
3,thought new iphone hi techwith push google california legalizes driverless cars via
3,driverless cars cure traffic
3,rt push google california legalizes driverless cars
3,purrfectly good driver rt oh mean driverless cars fb
3,capitol alert jerry brown signs driverless car bill
3,gov brown gives green light driverless cars california chicago tribune
3,gov brown gives green light driverless cars california chicago tribune
3,california governor brown signs bill clearing use driverless cars public roads video yes
3,google testing driverless cars ca
3,sleeping driverless cars got little bit closer mainstream
3,hard wrap head around driverless cars ca apparently via
3,first driver less car made
3,continental testing driverless car nevada
3,video california legalizes googles driverless cars ha said wouldnt happen
3,watching tv said driverless cars gonna hitting streets years
3,companies soon optimize high fuel costs driverless vehicles already legal ca nv fl supplychain google
3,driverless cars street legal california rt
3,driverless cars street legal california
3,driverless cars google goog
3,california signed bill permit driverless cars road bill entitled asians road act
3,neil driverless cars lt yrs everyone else lol wrong reality
3,driverless cars lt yrs internet lol wrong reality
3,wall e world getting closer gtgt push google california legalizes driverless cars nyt
3,jerry brown signed law bill allows driver less vehicles public streets california welcome future
3,california approves law googles driverless cars
3,california okays driverless cars take mine vw beetle call herby
3,google buys nest google makes driverless cars google makes phones google takes world google
3,amen sister truth invent driverless cars cannot create machines accept non crisp bills
3,gadgets stood priced driverless cars tvs watch companies
3,home automation driverless cars future google leader years automated cars norm
3,detroit auto show u build fake downtown test driverless cars testing site built
3,top line takeaways driverless cars drones headphone headphones headphones
3,great scott thought goggle would first driverless car show class
3,soondriverless technologies find way trucking industry read article follow us
3,carmakers driverless cars need legal framework ryan nakashima ap business writerlas vegas ap future
3,exactly happen driverless cars salesman literally live road
3,review one driverless cars ces
3,car drives itselfsounds awesomely futuristicbut safeheres works driverlesscar
3,dream last night rotary phone driverless car retrofuture
3,driverless car gets pulled speeding pays ticket
3,made driverless carèè
3,driverless cars
3,driverless cars whaaaaaaa è
3,driversseat driver less car not driving per say text
3,driverless future looking car looks like raindrop sciencefact
3,attention danish tweeps danish tv morgen around dk time talking societal impact driverless cars tune
3,govt regs drive tech make cars cleaner safer driverless cars next maybe need tech make guns cannot fire people
3,driverless car
3,massachusetts institute technology ford work driverless car massachusetts institute technology
2,take great concepts cars driverless amp electric make intentionally unappealing
2,hope hang right drive vindugoel googles next driverless cars no brakes steering wheel codecon
2,woke falling asleep couch craziest dream google made driverless cars say not not
2,look roadblocks facing driverless cars
2,hooli firstrt googles newest driverless car no wheel pedal buttons start panic
2,true think many claims impact driverless cars rely bit assumptions random usage rather peaks
2,driverless cars freaky hey time selfies
2,driverless cars yeahlike gonna let dui money cruise skynet sunset policestate
2,binge drinking massive job losses future driverless cars
2,q driverless cars prius driving prius not feel like driving like chewing prechewed gum bland pointless
2,already driverless cars called fucking public transportation
2,think google cars great looking no think type design cars driverless likely not
2,someone please explain point driverless cars seems like solution looking problem already taxis
2,google reveals driverless car passenger less not trust technology much
2,sorry know driverless cars great thing worry shall reduce ins entice actually improving infrastructure
2,not actually want google driverless car would much rather ride one work instead
2,google driverless car not stop free puppy sign bob lutz bigpicture
2,ok talk us not wanna approve googles driverless cars speeding ticket profits
2,key issue catastrophic accident driverless cars car decide whether gt people die
2,driverless cars show problem utilitarianism die accident occurs
2,driverless cars crash whos blame via anonymous
2,go read literally anything transit planning works talking counterproductive useless driverless cars
2,googles driverless car looks like koala remembered something embarrassing yrs ago
2,autonomous civil aircraft could flying cars go driverless lt aw hell no
2,watched segment not trust self driving cars yet ride driverless rapid transit
2,feeling driverless cars inferior solution already existing tech
2,oops eleanor holmes norton stalled driverless car ride
2,corrected streets area open source mapping bridges not not driver less cars stay away upstate ny
2,notes state laws not kept w technology not driverless car issue
2,driverless cars could get lazier happened driving fun makeitstop
2,driverless cars dont end world dont know
2,every time read story driverless cars get shiver spine alone
2,one driver less car works one not going happen
2,driver less cars using google maps could go wrong
2,betting driverless cars cool want underwater decade two
2,cannot jus trust emergency brake got block wheels driverless truck barrels
2,safety concern driverless cars
2,mt attitude innovation driverless cars put taxis bizfoster wless
2,driverless car one step closer losing freedom privacy another way monitor us
2,story everything rudderless congress breaks driverless car via
2,couple congressmen take driverless car spinand break driverless car
2,driverless car rolls hill blocks lower queen anne bouncing parked cars nobody hurt liveonkomo
2,googles driverless car need testing watchdog group warns
2,sf taxi drivers realize jobs likely not exist years driverless cars candidconversations
2,yeah google not tupperware meetup build driverless car cannot set high capacity wifi
2,I seeing crash cars alain declercq two driverless cars sometimes become almost crush
2,tear driverless cars away think
2,driverless trucks make hours service debates silly look back years freight nasstrac
2,future driving via need driverless cars people sleeping wheel
2,ugh rt driverless cars coming shall bring congestion fuel consumption
2,driverless taxis concern ranting cursing listen gartnersym
2,actually not crazy sounds better pay newspapers build driver less cars
2,driverless cars gave lb weapons tied remote control not think no need exists
2,driverless cars mean miles driven higher fuel consumption transportation
2,google driverless car today keep not going intend go
2,beats driverless cars rt google said deploy wi fi blimps africa asia goog
2,no driverless truck amp boone nat gas truck idea like havin bombs drivin lil people next em
2,fbi warns google driverless car could b used terrorism duh using pressurecooker
2,terrorism threatens driverless car ugh rt fbi worried driverless cars used bombs
2,fbi worried driverless cars used bombs looks like driverless cars dead
2,fbi says driverless cars good surveillance could used deadly weapons fbis thoughts
2,detroit unhappy googles push driverless cars tech cars
2,business insider fbi afraid criminals use googles driverless cars freeway shootouts goog
2,must develop policies prevent toyota official driverless cars could encourage sprawl
2,fbi driverless cars could make criminals dangerous also criminals dangerous cars horses
2,working wgoogle algorithms driverless cars annoy bike riders mirrortap rtredlightroll crosswlkignore kidding
2,driverless car revolution not begin cars via
2,ploop fbi warns driverless cars could used lethal weapons
2,fbi concerned driverless cars could accomplices drive shootings
2,heading jobless future no matter government exampledriverless cars taxis deliveries
2,driverless cars could increase pollution warns
2,many scenarios concerning civil rights spying espionage corporate exploitation ensue driverless cars futuretalk
2,know going kill driverless cars speed limit not able pass within three feet cyclists
2,brave new world gt driverless cars make police chases lethal
2,fbi warns driverless cars could become new letha
2,I skeptical driver less cars I I would freaked empty driver seat
2,googles driverless car safer average driver never get one drive
2,driverless cars apparently election worthy issue seriously florida
2,government regulation lawyers insurance companies long road go fully driverless sigh
2,not legalregulatory concerns driverless cars theres matter societal trust goodpoint
2,intersections would look like world driverless cars literally winced whole time
2,could technology lead unemployment no secret smart machines think googles driverless cars
2,colorado driverless car bill shelved notice êa bill allow driverless cars colorado highways
2,insure driverless car hurdles shall face
2,interesting driverless cars lead us jobless road
2,driverless cars iphones important securing ocean water supply desalination
2,seems like driverless cars scam put google amp software giants instead infrastructure trains
2,news flash already driverless cars called subways
2,want us believe self driving car malfunctioned google street view car not driverless car
2,not think understand point driverless vehicle
2,hmmm wonder insurance would driver less car yeah not practical
2,driverless cars took wrong spot says damn robots agree board bus delucchidoesgoogle
2,barrier driverless cars insurance liability cause accident
2,not need driverless cars decrease dependence fossil fuels no connection
2,try put driverless trucks highway snow storm idea kind goes hell
2,rt driverless cars not save environment
2,driverless car headless horse
2,driverless cars ruin thrill driving
2,driverless car prototype prius bad ideer
2,driverless car think notit b clstrfk lawsuts whose fault b crzy joke story rite
2,california drugs driverless cars legal
2,could possible go wrong california governor brown signs bill clearing use driverless cars public roads
2,driverless cars wtfè
2,cars killed us rt driverless cars mean no drivers licences
2,driverless cars legal california predict dramatic increase drive shootings unintendedconsequences
2,love picture nytimes picked driverless car legalization story google car crosswalk people front
2,driverless car rolls backwards parking space crashes pillar outside town amp country entrance bainbridge
2,driverless robo cars seems no fun
2,driverless cars great not not sustainable without honest energy policy per capita energy use defines future
2,myear parking revenues risk driverless cars park send car elsewhere plans
2,driverless cars think I done world cannot deal google coming everything
2,driverless cars u think not like idea è
2,gov browns press conference set dystopian future billionaire cyborgs unleash armies driverless cars
2,soon driverless cars become norm I shall I start riding motorcycle luddite
2,no not refuse one driverless car first real robot shall
2,driverless cars movie robot realistic
2,auto insurer not happy future driverless cars
1,google driver less car take steering wheel away cold dead hands buy one
1,yes meant sense people not not driving not need fn driverless passenger cars
1,hearing driverless cars coming da fuck people lazy seems dangerous hell
1,no way would put trust driverless car would lose people
1,watched video I home work wtf thought getting driverless car not orwellian big brother shit
1,good still not even self check rt driverless cars away think
1,oh hell no know enough computers not trust driverless car
1,driver less cars could potentially lethal news ticker yeah mean would think
1,not not already fbi warns driverless cars could used lethal weapons
1,thanks share driverless cars not make us thinner healthier happier driverless cars sprawl
1,also cars drivers fbi warns driverless cars could used lethal weapons
1,driverless automated cars waste money get fucking taxi
1,driverless cars terrible anyone fan mean cmon
1,driverless cars dumbest fing idea ever heard
1,google driver less car not viable insurance companies would no part
1,durham driverless car causes crash nc two people injured dur
1,car wars actionsci fi drew goddard future driverless cars become sentient turn human race
1,driverless cars take us wrong spot says damn robots agree board bus delucchidoesgoogle
1,driverless cars point
1,driverless cars wthi honestly not think good idea
1,google developing driverless car da facckk
1,driverless cars street legal california good reason leave ca no one behind wheel
1,systematically run driverless cars
